{"assumptions":{"base_scenario":"monte_carlo.base_scenario","covariance_model":"none","distribution":"independent normal per Cartesian component","scenario_id_order":"artifact.trajectories order"},"deterministic_seed":true,"generated_scenario_count":20,"generated_scenario_ids":["dispersion_1","dispersion_2","dispersion_3","dispersion_4","dispersion_5","dispersion_6","dispersion_7","dispersion_8","dispersion_9","dispersion_10","dispersion_11","dispersion_12","dispersion_13","dispersion_14","dispersion_15","dispersion_16","dispersion_17","dispersion_18","dispersion_19","dispersion_20"],"generator":"state_vector_dispersion","id_prefix":"dispersion","known_limits":["independent_axis_dispersion","no_covariance_matrix","no_truncated_distribution","not_a_statistical_validation"],"model":"seeded_independent_normal_cartesian_dispersion","model_limits":["independent_axis_dispersion","no_covariance_matrix","no_truncated_distribution","not_a_statistical_validation"],"position_sigma_km":[0.1,0.1,0.05],"requested_count":20,"rng":"rand_exsss","sampling_method":"box_muller_transform","schema_contract":"monte_carlo_reproducibility_report.v1","seed":12345,"seed_manifest":{},"source":"study_metadata.monte_carlo","velocity_sigma_km_s":[0.0001,0.0001,5.0e-5]}
